Category,Type,Quote,Criteria,Direction,QA Status,Comments
Summary,AI Governance Actor,"Comments consistently emphasized governance actors' high to primary responsibility for establishing standards and enforcement preventing systemic overreliance. Multiple responses highlighted their role in increasing public awareness of overreliance risks, informing users about decisions that shouldn't be delegated, and stepping in where corporate incentives won't align. Comments noted governance failure in prohibiting sensitive applications without appropriate testing.",Responsibility,Higher,,
Summary,AI User,"Comments varied widely on user responsibility, with most rating users as moderately responsible for exercising judgment though control is limited. Several noted users enter social contracts for intended use, bearing partial responsibility for overuse and moral obligations for good versus bad use, with primary fault for delegating key decisions. However, others emphasized users cannot be fully responsible when developers drive engagement without proper risk information.",Responsibility,Higher,,
Summary,AI Infrastructure Provider,"Comments consistently characterized infrastructure providers as minimally responsible, providing backbone systems but not directly influencing reliance behaviors, though one comment included them among primarily responsible parties controlling conditions under which overreliance occurs.",Responsibility,Lower,,
Summary,Affected Stakeholder,"Comments varied on affected stakeholder responsibility, with most characterizing them as not at all responsible, suffering harms but unable to prevent overreliance. However, one comment noted stakeholders have ethical duties when deploying AI in vulnerable settings. Comments emphasized stakeholders are most vulnerable through exposure to upstream users' overreliance, such as citizens exposed to risk from public service workers' overreliance.",Responsibility,Lower,,
Summary,Affected Stakeholder,"Comments consistently rated affected stakeholders as most vulnerable with limited agency to mitigate risks, exposed to harm through upstream users' overreliance such as citizens affected by public service workers' AI dependence.",Vulnerability,Higher,,
Summary,Health Care and Social Assistance,"Comments unanimously rated healthcare as extremely vulnerable where excessive trust leads to direct harm and life-threatening risks from over-trusting diagnostics or treatment advice. Multiple responses emphasized healthcare workers already at high risk for depression and burnout are extremely vulnerable to relying on AI instead of professional counseling, with medical professionals facing risks from confident but subtly incorrect clinical information.",Vulnerability,Higher,,
Summary,National Security,"Comments consistently characterized national security as extremely vulnerable where over-trusting defense or intelligence systems could trigger catastrophic outcomes. Responses noted malicious actors already exploit military service members through social media and dating apps, with AI enhancing malicious capabilities for greater access and persuasion, creating life- and safety-critical risks.",Vulnerability,Higher,,
Summary,Finance and Insurance,"Comments consistently rated finance as highly to extremely vulnerable where overreliance in scoring, fraud detection, and trading risks systemic instability. Responses emphasized algorithmic finance decision-making creates higher vulnerability due to tightly networked systems where automated errors can cascade into systemic disruption.",Vulnerability,Higher,,
Summary,Educational Services,"Comments unanimously characterized education as highly vulnerable where excessive trust leads to erosion of autonomy, with overuse in grading and proctoring risking fairness and judgment issues. Multiple responses noted teachers and students developing inappropriate dependence on AI for learning and assessment, with educators among those trusting AI implicitly creating silent delegation risks.",Vulnerability,Higher,,
Summary,Public Administration excluding National Security,"Comments consistently rated public administration as highly vulnerable due to reliance on automated decision-making, with overreliance in resource allocation and policing risking bias and erosion of trust. Responses noted even minimal reliance on unsafe systems affects many people, making user vulnerability very high in this sector.",Vulnerability,Higher,,
Summary,"Trade, Transportation, and Utilities",Comments unanimously characterized transportation and utilities as highly vulnerable where logistics and smart grids create cascading risks if overrelied upon. Responses emphasized these are life- and safety-critical tightly networked systems where automated errors or cyber-triggered outages can quickly cascade into physical harm and systemic disruption.,Vulnerability,Higher,,
Summary,Information,"Comments consistently rated information sector as extremely vulnerable where human judgment risks replacement by automated systems with significant consequences. Responses noted overuse in content moderation and personalization risks misinformation and manipulation, with journalists and researchers unknowingly propagating AI-generated misinformation due to plausible LLM outputs. Sectors using AI for automation and services see highest dependencies through chatbots and digital entities.",Vulnerability,Higher,,
Summary,Professional and Technical Services,"Comments consistently characterized professional services as highly vulnerable where professionals may over-trust AI in legal, consulting, or engineering tasks. Responses noted consultants and analysts risk over-relying on AI for complex problem-solving where nuanced human judgment is critical.",Vulnerability,Higher,,
Summary,Scientific Research and Development,"Comments varied on scientific research vulnerability, with some rating it highly vulnerable due to heavy reliance in biotech and materials science risking false or unsafe conclusions, while others rated it moderately vulnerable where autonomy risks are present but not always life-critical.",Vulnerability,Higher,,
Summary,"Management, Administrative, and Support Services","Comments characterized management services as moderately to highly vulnerable due to reliance on automated decision-making, with HR and workflow automation risking bias and fragile dependencies.",Vulnerability,Higher,,
Summary,"Arts, Entertainment, and Recreation","Comments varied on arts vulnerability, with some rating it moderately vulnerable where autonomy risks exist but aren't life-critical, while others noted AI in content personalization and creation risks cultural/creative overdependence. Sectors with stronger human-in-the-loop oversight face lower risks as failures are caught early.",Vulnerability,Lower,,
Summary,"Agriculture, Mining, Construction and Manufacturing",Comments consistently characterized these sectors as moderately vulnerable where robotics and predictive tools can be misused but autonomy risks aren't always life-critical. Responses noted sectors with bounded tasks and stronger human-in-the-loop oversight face lower risks as failures are caught early and remain operational rather than catastrophic.,Vulnerability,Lower,,
Summary,Real Estate and Rental and Leasing,"Comments consistently characterized real estate as minimally to moderately vulnerable with limited exposure, where valuations and tenant screening may lead to bias but risks are less critical. Sectors with bounded tasks and human oversight face lower risks as failures remain operational rather than catastrophic.",Vulnerability,Lower,,
Summary,"Accommodation, Food, and Other Services","Comments consistently rated accommodation services as minimally to moderately vulnerable with limited exposure, where booking and delivery systems risk failures and misuse but consequences are less critical.",Vulnerability,Lower,,